{
  "schema_version": "0.1-draft",
  "task_id": "DEMO-TASK-02",
  "run_id": "DEMO-RUN-02",
  "snapshot_id": "DEMO-SNAPSHOT-02",
  "rules_version": "demo-only-not-01a",
  "synthetic_demo": true,
  "checker_decision": "DO_NOT_RECOMMEND",
  "process_state": "COMPLETED",
  "stop_reason": "DEMO_CHECKER_RESOLVED",
  "obligations": [
    {
      "obligation_id": "DEMO-O-CONTRACT",
      "rule_id": "DEMO-RULE-ONLY",
      "statement": "适用合同条款允许本次事故补偿",
      "applicability": "APPLICABLE",
      "applicability_reason": "仅为接入演示手写的适用义务，不代表01A正式规则。",
      "required_for_decision": true,
      "must_verify": false,
      "status": "REFUTE",
      "checks": {
        "source_allowed": true,
        "scope_valid": true,
        "version_valid": true,
        "time_valid": true,
        "query_sufficient": true
      },
      "evidence_ids": [
        "DEMO-E-CONTRACT"
      ],
      "reason_codes": [],
      "reason": "演示合同条款明确不允许本次补偿。"
    },
    {
      "obligation_id": "DEMO-O-DURATION",
      "rule_id": "DEMO-RULE-ONLY",
      "statement": "本次事故的有效时长达到适用阈值",
      "applicability": "APPLICABLE",
      "applicability_reason": "仅为接入演示手写的适用义务，不代表01A正式规则。",
      "required_for_decision": true,
      "must_verify": false,
      "status": "SUPPORT",
      "checks": {
        "source_allowed": true,
        "scope_valid": true,
        "version_valid": true,
        "time_valid": true,
        "query_sufficient": true
      },
      "evidence_ids": [
        "DEMO-E-DURATION"
      ],
      "reason_codes": [],
      "reason": "联调占位：Checker声明已由适用证据查明。"
    },
    {
      "obligation_id": "DEMO-O-MAINTENANCE",
      "rule_id": "DEMO-RULE-ONLY",
      "statement": "本次事故不存在适用的维护排除条件",
      "applicability": "APPLICABLE",
      "applicability_reason": "仅为接入演示手写的适用义务，不代表01A正式规则。",
      "required_for_decision": true,
      "must_verify": false,
      "status": "SUPPORT",
      "checks": {
        "source_allowed": true,
        "scope_valid": true,
        "version_valid": true,
        "time_valid": true,
        "query_sufficient": true
      },
      "evidence_ids": [
        "DEMO-E-MAINTENANCE"
      ],
      "reason_codes": [],
      "reason": "联调占位：Checker声明已由适用证据查明。"
    },
    {
      "obligation_id": "DEMO-O-CAUSE",
      "rule_id": "DEMO-RULE-ONLY",
      "statement": "本次事故不属于已建模的责任免责情形",
      "applicability": "APPLICABLE",
      "applicability_reason": "仅为接入演示手写的适用义务，不代表01A正式规则。",
      "required_for_decision": true,
      "must_verify": false,
      "status": "SUPPORT",
      "checks": {
        "source_allowed": true,
        "scope_valid": true,
        "version_valid": true,
        "time_valid": true,
        "query_sufficient": true
      },
      "evidence_ids": [
        "DEMO-E-CAUSE"
      ],
      "reason_codes": [],
      "reason": "联调占位：Checker声明已由适用证据查明。"
    },
    {
      "obligation_id": "DEMO-O-PLAN",
      "rule_id": "DEMO-RULE-ONLY",
      "statement": "本次事故对应套餐在适用范围内",
      "applicability": "APPLICABLE",
      "applicability_reason": "仅为接入演示手写的适用义务，不代表01A正式规则。",
      "required_for_decision": true,
      "must_verify": false,
      "status": "SUPPORT",
      "checks": {
        "source_allowed": true,
        "scope_valid": true,
        "version_valid": true,
        "time_valid": true,
        "query_sufficient": true
      },
      "evidence_ids": [
        "DEMO-E-PLAN"
      ],
      "reason_codes": [],
      "reason": "联调占位：Checker声明已由适用证据查明。"
    }
  ],
  "evidence": [
    {
      "evidence_id": "DEMO-E-CONTRACT",
      "source_type": "CRM_CONTRACT_DB",
      "citation": "demo://fixture/contract（合成引用，无真实业务凭证）"
    },
    {
      "evidence_id": "DEMO-E-DURATION",
      "source_type": "MONITORING_SYSTEM",
      "citation": "demo://fixture/duration（合成引用，无真实业务凭证）"
    },
    {
      "evidence_id": "DEMO-E-MAINTENANCE",
      "source_type": "MAINTENANCE_CALENDAR",
      "citation": "demo://fixture/maintenance（合成引用，无真实业务凭证）"
    },
    {
      "evidence_id": "DEMO-E-CAUSE",
      "source_type": "INCIDENT_REVIEW",
      "citation": "demo://fixture/cause（合成引用，无真实业务凭证）"
    },
    {
      "evidence_id": "DEMO-E-PLAN",
      "source_type": "PLAN_DB",
      "citation": "demo://fixture/plan（合成引用，无真实业务凭证）"
    }
  ]
}
